C0214A,"Macarrão, trigo, c/ ovos, c/ alho e óleo, c/ sal,",754,179,"62,7","25,8","24,9","3,64","7,05","0,95",0,"0,72","5,51","1,15","1,61","4,1","0,06","6,88","1,05",190,"1,53",46,"63,5","0,31","0,07","1,76",0,0,0,"0,89","0,04","0,02","1,23","0,04",0,"1,49",60,"0,47",0
C0237A,"Macarrão, trigo, integral, c/ molho branco (leite, manteiga e farinha de trigo), c/ sal,",575,136,"67,1","24,3","21,4","4,99","2,78","2,85",0,"0,89","3,69","1,16","0,62","0,75","0,01","39,3","0,46",208,"13,1","65,8","78,2","0,45","0,06","3,65","19,7","19,5",0,"0,35","0,09","0,11","2,02","0,06","0,11",0,"18,6","0,47",0
C0835A,"Macarrão, trigo, integral, cozido, drenado, s/ óleo, c/ sal,",520,123,"67,7","26,3","22,8","4,89","0,56","3,5",0,"0,58",0,"0,17","0,07","0,22",0,"8,53","0,44",129,"12,1","48,8","45,4","0,4","0,07","2,62",NA,NA,0,"0,09","0,09","0,05","1,97","0,08",0,0,"16,9","0,47",0
C0238A,"Macarrão, c/ molho bolonhesa, c/ sal, (macarrão - espaguete, carne bovina - patinho moído, tomate, cebola, alho, c/ óleo de soja),",520,123,"70,1","22,5","21,5","4,42","1,94","1,03",0,"0,97","8,54","0,49","0,5","0,84","0,04","10,4","1,36","8,77","9,79","52,9",82,"0,74","0,09",tr,0,0,0,0,0,0,0,0,"0,16",0,0,"0,47",0
C0885A,"Macarrão, carbonara, c/ sal, (macarrão, trigo, cozido, ovo de galinha, c/ toucinho defumado (bacon), c/ queijo permesão, c/ pimenta-do-reino, c/ sal,",1115,268,"54,4","12,7",12,"12,9","18,5","0,71",0,"1,45",191,"6,78","6,89","3,02","0,25",133,"1,38",364,"8,35",173,"83,8","1,19","0,06","8,92","64,6","63,6","0,88","1,24","0,05","0,12","1,37","0,02","0,69",0,"48,2","0,47",0
C0909A,"Macarrão, trigo cozido, c/ molho pesto (azeite de oliva, queijo permesão, manjericão, noz, alho, c/ pimenta-do-reino), c/ sal,",964,231,58,"21,6","20,4","5,3",14,"1,27",0,"1,12","9,28","3,01","8,08","2,49","0,1","81,4","1,31",294,"9,69","90,8","63,6","0,62","0,08","3,15","46,5","25,5","0,04","1,83","0,05","0,04","1,01","0,03","0,08","0,48","54,3","0,47",0
C0911A,"Macarrão, trigo integral cozido, c/ molho pesto (azeite de oliva, queijo permesão, manjericão, noz, alho, c/ pimenta-do-reino), c/ sal,",955,229,"57,4","21,1","17,9","6,31",14,"3,21",0,"1,18","6,98","3,02","8,05","2,49","0,08","83,2","0,58",294,"18,8",100,"75,6","0,67","0,1","3,79","46,5","25,5","0,04","1,86","0,09","0,08","1,55","0,09","0,08","0,48","16,8","0,47",0
C0220A,"Macarrão, trigo, c/ ovos, c/ molho branco (leite, manteiga e farinha de trigo), c/ sal,",586,139,"67,7","24,6","23,9","3,96","2,88","0,69",0,"0,83","8,59","1,17","0,67","0,78","0,04","37,7","0,99",209,"3,45","58,2","64,3","0,36","0,04","2,98","19,7","19,5",0,"0,32","0,04","0,08","1,54","0,01","0,11",0,"58,4","0,47",0
C0218A,"Macarrão, trigo, c/ ovos, c/ molho de tomate (tomate, c/ óleo, cebola e alho), c/ sal,",488,115,"71,4","22,9","21,7","3,19","1,49","1,23",0,"0,95","2,46","0,28","0,32","0,78","0,02","7,27","0,28",268,"3,14","36,4","83,8","0,32","0,06","1,5","26,7","13,3",0,"0,26","0,06","0,02",1,"0,02",0,"3,98","56,7","0,47",0
C0235A,"Macarrão, trigo, integral, c/ molho de tomate (tomate, c/ óleo, cebola e alho), c/ sal,",478,113,"70,9","22,4","19,1","4,27","1,5","3,31",0,"1,02",0,"0,29","0,3","0,79",0,"9,18","0,45",269,"12,9","46,5","97,6","0,37","0,08","2,17","27,2","13,6",0,"0,3","0,1","0,05","1,57","0,08",0,"4,05","16,8","0,47",0