ID,ALIMENTO,Energia KJ,Energia Kcal,Umidade g,Carboidrato total,Carboidrato disponível,Proteína,Lipídios,Fibra alimentar,Álcool,Cinzas,Colesterol,Ácidos graxos saturados,Ácidos graxos monoinsaturados,Ácidos graxos polinsaturados,Ácidos graxos trans,Cálcio,Ferro,Sódio,Magnésio,Fósforo,Potássio,Zinco,Cobre,Selênio,Vitamina A (RE),Vitamina A (RAE),Vitamina D,Alfa-tocoferol (Vitamina E),Tiamina,Riboflavina,Niacina,Vitamina B6,Vitamina B12,Vitamina C,Equivalente de folato,Sal de adição,Açúcar de adição
C0209A,"Arroz, polido, cozido, c/ óleo, cebola e alho, c/ sal,",583,138,"66,1","29,1","2,4","1,59","1,27",0,0,"5,83","0,33",189,"23,6","22,3","31,7","0,51","0,15","1,64",0,0,0,"0,18","0,01",0,"0,45","0,47",0,,,,,,,,,,
C0108T,"feijão, preto, cozido (50% grão e 50% caldo), c/ óleo e cebola e alho, c/ sal,Phaseolus vulgaris L.,",302,73,"78,6",14,"4,38","1,71","8,07",0,0,"28,4","1,41",189,"38,9","86,8",257,"1,76","0,54","2,59",0,0,0,"0,16","0,04",0,"0,45","0,47",0,,,,,,,,,,
C0002C,"Abacaxi, polpa,in natura,Ananas comosus L.,",211,50,87,"11,6","0,68","0,33","1,12",0,0,"18,4","0,47","2,84","16,6","10,5",137,"0,15","0,12","0,41",2,1,0,"0,05",tr,0,"33,1",0,0,,,,,,,,,,
C0007C,"Banana, nanica,in natura, Musa spp.,",386,91,"75,9","21,8","1,32","0,21","1,7",0,0,"3,15","0,32",tr,"25,6","24,6",346,"0,16","0,09","0,13","13,7","6,83",0,"0,06","0,13",0,"5,39",0,0,,,,,,,,,,
C0020C,"Laranja, Pera,in natura, Citrus sinensis,",157,37,"89,9","8,63","0,87","0,21","1,36",0,0,"21,3","0,09",tr,"8,36",22,158,"0,06","0,03","0,3","1,83","0,92",0,"0,31","0,02",0,"52,2",0,0,,,,,,,,,,
C0045C,"mamão, Formosa, polpa,in natura,Carica papaya L.,",198,47,"86,9","11,6","0,82","0,12","1,81",0,0,"24,9","0,23","3,26","17,3","10,9",221,"0,07","1,36","0,3","85,9",43,0,"0,14",tr,0,"78,5",0,0,,,,,,,,,,
C0027C,"Melancia, polpa,in natura, Citrullus spp.,",124,29,"92,5","6,52","0,7","0,05","0,13",0,0,"8,06","0,18",tr,"8,06","9,79","83,6","0,08",tr,"0,6",61,"30,5",0,0,tr,0,"4,94",0,0,,,,,,,,,,
C0035C,"Uva, Rubi,in natura,Vitis vinifera L. Rubi,",213,50,"86,8","12,1","11,2","0,54","0,17","0,89",0,"0,38",0,"0,06","0,01","0,05",0,"7,22","0,16","7,51","5,53","21,6",150,tr,"0,05","0,1","5,33","2,67",0,"0,21","0,02","0,02",tr,tr,0,"1,77","1,36",0,0
C0029C,"Morango,in natura,Fragaria vesca L.,",125,30,"91,8","6,54","4,87","0,82","0,4","1,67",0,"0,45",0,"0,02","0,06","0,3",0,"15,4","0,28",11,11,"28,8",102,"0,09","0,05","0,36","8,93","4,46",0,"0,39",tr,"0,03",tr,"0,03",0,"69,8","21,8",0,0
C0048C,"Manga, Tommy Atkins, polpa,in natura,Mangifera indica L.,",221,52,"85,8","12,8","10,7","0,86","0,22","2,07",0,"0,34",0,"0,1","0,1",tr,tr,"7,64","0,08",tr,"7,4","13,8",138,"0,08","0,06","0,9",180,"90,4",0,"0,52",tr,"0,04",tr,"0,03",0,"7,94","36,9",0,0
C0003C,"Açaí­, polpa (média de amostras),Euterpe oleracea Mart.,",278,68,"86,1","7,66","1,77","0,9","5,01","5,89",0,"0,31",0,"1,01","3,43","0,32",NA,"20,8","0,59","1,69","20,9","20,2",110,"0,23","0,2","0,7","28,6","14,3",NA,"14,8",tr,"0,04",tr,"0,08",0,42,NA,0,0
C0066C,"Mexerica,'Rio', in natura, Citrus reticulata,",150,36,"89,6","9,34","6,61","0,65","0,13","2,73",0,"0,32",0,"0,02","0,02","0,03",0,"17,2","0,09","1,82","8,21","13,7",124,"0,15","0,07","0,07","28,2","14,1",0,"0,08","0,03",tr,tr,tr,0,111,"11,3",0,0
C0064C,"Maçã, Fuji, c/ casca,in natura, Malus domestica,",250,59,"84,3","15,2","13,8","0,29",tr,"1,35",0,"0,22",0,tr,tr,tr,0,"1,92","0,09",tr,"2,04","9,08","74,7",tr,"0,06",0,7,"3,5",0,"0,18",tr,tr,tr,"0,03",0,"2,41","3,25",0,0
C0354F,"Carne, boi, acém moída, cozida, c/ óleo, cebola e alho, c/ sal,",867,208,"61,1","0,68","0,56","25,5","11,5","0,12",0,"1,28",98,"4,73","4,63","0,94","0,23","4,69","2,54",229,17,159,256,"7,71","0,07","0,03",0,0,"2,64","0,2",0,"0,3","1,68","0,01","2,47","0,41","5,52","0,45",0
C0608F,"Carne, boi, alcatra, frita (c/ óleo de soja), c/ sal, Bos taurus,",1186,285,48,0,0,"29,2","18,6",0,0,"1,56","84,4","5,88","6,34","5,05","0,24","4,24","2,91",227,"23,8",255,352,"4,42","0,12","5,17",tr,tr,"0,14","1,31","0,03","0,05","4,27","0,05","2,87",0,"13,1","0,45",0
C0322F,"Carne, boi, capa de contra-filé, c/ gordura, grelhada, c/ manteiga, c/ sal,",1445,348,"44,6",0,0,"27,7","26,2",0,0,"1,47",128,"12,8","9,92","0,41","0,54","6,98","2,33",252,"16,7",192,291,"5,58","0,12","0,1","99,4","98,1","0,11","0,24",0,"0,06","1,57",0,"3,47",0,"6,87","0,45",0
C0660F,"Carne, boi, charque (carne seca, carne de sol, jaba), dessalgada, frita (c/ óleo de soja), s/ sal, Bos taurus,",1270,305,"42,1",0,0,"33,5",19,0,0,"3,34",104,"5,63","6,83","5,17","0,41","13,7","3,18",1327,"11,8","92,8","82,4","5,6","0,09","6,96",tr,tr,"0,13","1,09","0,05","0,06","1,38",tr,"0,39",0,"56,7",0,0
C0661F,"Carne, boi, charque (carne seca, carne de sol, jaba), dessalgada, refogada (c/ óleo, cebola e alho), s/ sal, Bos taurus,",1065,254,"46,3","0,75","0,61","34,7","12,5","0,14",0,"3,49",107,"4,75","5,41","1,1","0,39","14,9","3,3",1370,13,"99,5",100,"5,8","0,07","7,22",tr,tr,"0,14","0,38","0,05","0,07","1,43","0,01","0,4","0,45","59,2",0,0
C0334F,"Carne, boi, contra-filé de costela, grelhada, c/ óleo e cebola, c/ sal,",1252,300,"48,4","0,73","0,63","29,2","20,1","0,11",0,"1,55",114,"8,52","8,51","0,91","0,29","7,73","2,47",256,"18,1",204,316,"5,9","0,13",0,0,0,"0,12","0,13",0,"0,06","1,66","0,01","3,64","0,21","7,67","0,45",0
C0296F,"Carne, boi, contra-filé, grelhado/frito, c/ óleo e cebola, c/ sal,",1316,316,"48,2","0,51","0,4","26,9",23,"0,11",0,"1,38","86,3","5,39","5,37","0,82","0,22","8,08","2,58",247,"17,9",203,314,"5,03","0,08",0,0,0,0,"0,13",0,"0,07","2,06","0,14","1,28","0,21","0,73","0,45",0
C0302F,"Carne, boi, contra-filé, grelhado/frito, c/ manteiga, c/ sal,",1505,363,"44,2",0,0,"25,4",29,0,0,"1,31",102,"9,87","6,95","0,32","0,48","7,31","2,43",244,"16,5",191,289,"4,76","0,08","0,1","99,4","98,1",0,"0,24",0,"0,07","1,95","0,13","1,23",0,"0,3","0,45",0
C0870F,"Carne, boi, coração, cozido, c/ óleo, c/ sal,",917,219,"58,5",0,0,"28,1","11,9",0,0,"1,53",161,"2,41","2,75","6,14",0,"6,41","7,39",259,"20,7",0,"0,04","3,33","0,03",0,NA,NA,NA,"0,16","0,14","1,62","6,3","0,02","2,33","29,4","7,2","0,45",0
C0869F,"Carne, boi, costela, cozida, c/ óleo, c/ sal,",1428,344,"45,1",0,0,"27,7","25,9",0,0,"1,33","83,7","8,47","9,42","6,19",0,10,"3,03",231,"19,8",211,281,"7,02","0,13","19,9",NA,NA,0,"0,28","0,06","0,18","2,89","0,25","3,11",0,"6,3","0,45",0
C0369F,"Carne, boi, coxão mole (polpa, chã de dentro), s/ gordura, cozida, c/ óleo, cebola e alho, c/ sal,",886,211,"57,4","0,68","0,56","30,7","9,57","0,12",0,"1,65","79,9","4,25","3,49","0,85","0,2","4,41","2,45",221,"13,6",176,240,"4,48","0,12","0,03","2,34","2,34",0,"0,49",0,0,"3,89","0,01","4,89","0,41",10,"0,45",0
C0924F,"Carne, boi, coxão mole (polpa, chã de dentro), s/ gordura, frita (c/ óleo de soja), c/ cebola, c/ sal,",1012,242,56,"0,88","0,68",27,"14,6","0,2",0,"1,52","69,7","4,66","4,49","4,49","0,2","4,54","2,14",215,"12,3",155,215,"3,91","0,12","3,48","2,04","2,04",0,"1,07",0,0,"3,39","0,01","1,47","0,4","5,46","0,45",0
C0597F,"Carne, boi, filé mignon, s/ gordura, frita (c/ óleo de soja), c/ sal, Bos taurus,",1105,265,"52,2",0,0,30,"16,1",0,0,"1,66","94,2","5,33","4,69","4,96","0,19","4,06","2,63",232,"25,9",282,298,"3,79","0,15","7,29",tr,tr,"0,12","1,21","0,03","0,07","3,91","0,04","1,24",0,"15,7","0,45",0
C0374F,"Carne, boi, filé mignon, s/ gordura, grelhada, c/ óleo, cebola e alho, c/ sal,",889,212,57,"0,52","0,42","31,3","9,44","0,11",0,"1,74","97,7","4,44","3,19","0,82","0,16","4,93","2,74",234,"27,5",294,319,"3,94","0,14",0,0,0,"0,11","0,13","0,03","0,08","4,05","0,05","4,75","0,21","8,86","0,45",0
C0380F,"Carne, boi, filé mignon, s/ gordura, grelhada, c/ manteiga, c/ sal,",1101,264,"52,6",0,0,"29,6","16,2",0,0,"1,65",113,"8,97","4,88","0,32","0,41","4,33","2,58",232,"25,6",277,293,"3,72","0,13","0,1","99,4","98,1","0,11","0,24","0,03","0,07","3,84","0,04","4,51",0,8,"0,45",0
C0595F,"Carne, boi, filé mignon, s/ gordura, grelhada/assada, s/ óleo, c/ sal, Bos taurus,",880,210,"56,7",0,0,"32,7","8,79",0,0,"1,77",102,"4,48","3,09","0,2","0,16","4,4","2,86",237,"28,1",306,324,"4,12","0,14","7,92",tr,tr,"0,13","0,37","0,03","0,08","4,25","0,05","1,35",0,17,"0,45",0
C0804F,"Carne, boi, fraldinha, c/ gordura, frita (c/ óleo de soja), c/ sal, Bos taurus,",1205,290,"55,3",0,0,"19,9","23,4",0,0,"1,42",52,"8,2","8,08","5,07","0,45","3,62","1,75",223,"17,3",133,232,"4,74","0,08","4,72","4,46","4,46","0,13","1,18","0,06","0,07","3,42","0,02","1,24",0,"13,2","0,45",0
C0431F,"Carne, boi, paleta, s/ gordura, cozida, refogada (c/ óleo, cebola e alho), c/ sal,",786,187,"61,9","0,68","0,56","28,2","8,03","0,12",0,"1,29","52,8","3,4","3,11","0,85","0,16","6,23","2,08",234,"17,5",190,251,"6,49","0,1","0,03",0,0,0,"0,3","0,04","0,04","2,06","0,01","4,91","0,41","8,93","0,45",0
C0665F,"Carne, boi, paleta, s/ gordura, frita (c/ óleo de soja), c/ sal, Bos taurus,",1008,242,"57,6",0,0,"27,2","14,7",0,0,"1,22","50,9","4,32","4,6","4,96","0,19","5,28","1,99",232,"16,2",180,228,"6,24","0,11","2,68",tr,tr,"0,07","0,97","0,03","0,04","1,98",tr,"3,47",0,"6,99","0,45",0
C0634F,"Carne, boi, patinho, s/ gordura, frita (c/ óleo de soja), c/ sal, Bos taurus,",1101,263,"50,5",0,0,"32,9","14,7",0,0,"1,64",115,"4,05","4,69","5,05","0,15","4,5","2,78",234,25,264,385,"7,41","0,14","3,44",tr,tr,"0,07","1,17","0,03","0,03","2,76",tr,"2,01",0,"17,4","0,45",0
C0441F,"Carne, boi, patinho, s/ gordura, grelhada, c/ óleo, cebola e alho, c/ sal,",890,212,"55,3","0,79","0,69","34,2",8,"0,11",0,"1,71",119,"3,11","3,19","0,91","0,12","5,39","2,89",237,"26,5",276,409,"7,7","0,12",0,0,0,0,"0,33","0,04","0,03","2,86","0,01","3,98","0,21","13,1","0,45",0
C0447F,"Carne, boi, patinho, s/ gordura, grelhada, c/ manteiga, c/ sal,",1102,264,"51,2",0,0,"32,3","14,8",0,0,"1,63",133,"7,71","4,88","0,41","0,38","4,77","2,73",234,"24,7",260,379,"7,28","0,12","0,1","99,4","98,1",0,"0,43","0,03","0,03","2,71",0,"3,79",0,12,"0,45",0
C0823F,"Carne, boi, picanha, grelhada/assada, s/ óleo, c/ sal (média de amostras c/ e s/ gordura), Bos taurus,",1062,254,"53,8",0,0,29,"15,4",0,0,"1,6","95,3","6,17","7,17","0,35","0,2","4,3","3,36",239,"24,6",262,364,"6,07","0,16","41,4",tr,tr,"0,13","0,47","0,01","0,07","1,7","0,08","3,35",0,"3,99","0,45",0
C0466F,"Carne, boi, picanha, s/ gordura, grelhada, c/ manteiga, c/ sal,",1183,284,"51,3",0,0,"28,8","18,4",0,0,"1,56",110,"8,97","6,77","0,41","0,39","4,44","3,2",234,23,254,339,"6,03","0,16","0,1","99,4","98,1","0,27",1,0,"0,08","1,64","0,03","2,38",0,"0,3","0,45",0
C0742F,"Carne, frango, asa, c/ pele, assada, s/ óleo, c/ sal, Gallus gallus,",969,233,"61,7",0,0,"23,1","15,6",0,0,"1,33",125,"4,89","7,33","3,33","0,04",14,"0,69",284,"23,7",158,161,"1,59","0,02","11,6","9,93","9,93","0,11","0,77","0,08","0,06","2,64",tr,"0,22",0,"5,66","0,45",0
C0740F,"Carne, frango, asa, c/ pele, cozida (lí­quido do cozimento excluído), s/ óleo, c/ sal, Gallus gallus,",924,222,64,0,0,21,"15,3",0,0,"1,25",114,"4,43","6,65","3,02","0,04","10,8","0,53",224,"18,8",125,"97,8","1,44","0,01","10,5","6,6","6,6","0,07","0,48","0,07","0,05","1,79",tr,"0,15",0,"4,28","0,45",0
C0744F,"Carne, frango, asa, c/ pele, frita (c/ óleo de soja), c/ sal, Gallus gallus,",1186,286,"56,7",0,0,"21,3","22,3",0,0,"1,26",115,"5,71","8,6","7,84","0,08","12,9","0,64",275,"21,8",145,148,"1,47","0,04","10,7",tr,tr,"0,1","1,67","0,08","0,05","2,43",tr,"0,2",0,"5,21","0,45",0
C0773F,"Carne, frango, coração, frita (c/ óleo de soja), c/ sal, Gallus gallus,",1054,254,"58,2",0,0,"20,6",19,0,0,"1,68",256,"4,42","5,76","6,23","0,13","7,76","5,98",297,"18,4",252,222,"3,16","0,28","5,44",tr,tr,NA,NA,"0,18","0,18","8,88",tr,"6,45","3,03","59,2","0,45",0
C0771F,"Carne, frango, coração, grelhada, s/ óleo, c/ sal, Gallus gallus,",825,198,"63,2",0,0,"22,3",12,0,0,"1,79",279,"3,48","4,24","1,58","0,1","8,42","6,5",307,20,274,241,"3,43","0,3","5,91",tr,tr,NA,NA,"0,2","0,19","9,66",tr,"7,01","3,3","64,3","0,45",0
C0842F,"Carne, frango, coxa, c/ pele, assada, s/ óleo, c/ sal,",865,207,"59,5","0,06","0,06","28,4","10,3",0,0,"1,74",144,"3,09","3,78","2,19","0,14","8,41","1,21",274,"13,9",250,316,"2,54","0,05",NA,NA,NA,"0,13","0,21","0,05","0,05","10,4",0,"0,48",0,"6,19","0,45",0
C0843F,"Carne, frango, coxa, s/ pele, cozida, s/ óleo, c/ sal,",668,159,"66,3",0,0,"26,6","5,82",0,0,"1,32",132,"1,99","2,09","1,1",0,"11,8","0,82",243,"11,1",185,190,"2,82","0,03",NA,NA,NA,"0,04","0,21","0,05","0,05","10,4",tr,"0,48",0,"6,19","0,45",0
C0685F,"Carne, porco, bisteca, frita (c/ óleo de soja), c/ sal, Sus ssp,",1253,300,"47,1",0,0,"33,6","18,4",0,0,2,125,"5,95","6,55","4,54","0,21","68,9","0,82",242,29,288,401,"2,16","0,06","49,3","9,7","9,7","0,46","1,13","0,34",tr,"3,23",tr,"0,47",0,0,"0,45",0
C0689F,"Carne, porco, costela, assada, s/ óleo, c/ sal, Sus ssp,",1627,392,"36,8",0,0,"30,1","30,1",0,0,"1,82",112,"11,7","13,8","3,09","0,06","16,8","1,03",242,14,199,244,"3,08","0,07","8,42",tr,tr,"0,59","0,34","0,71","0,05","10,6",tr,"0,62",0,0,"0,45",0
C0692F,"Carne, porco, costela, frita (c/ óleo de soja), c/ sal, Sus ssp,",1791,432,"33,8",0,0,"27,7","35,7",0,0,"1,71",103,12,"14,6","7,62","0,09","15,5","0,96",237,"12,9",183,225,"2,84","0,09","7,75",tr,tr,"0,55","1,28","0,65","0,05","9,74",0,"0,57",0,0,"0,45",0
C0694F,"Carne, porco, costela, refogada (c/ óleo, cebola e alho), c/ sal, Sus ssp,",1734,418,"34,9","0,74","0,61","29,2","33,2","0,13",0,"1,98",110,"12,1","13,7","4,43","0,01","24,4","1,47",321,"29,8",260,415,"4,33","0,1","8,42",tr,tr,"0,59","0,55","0,71",0,"10,7","0,01","0,62","0,45","0,69","0,45",0
C0697F,"Carne, porco, lombo, grelhada/assada, s/ óleo, c/ sal, Sus ssp,",840,200,"56,3",0,0,"35,6","6,37",0,0,"1,81",102,"2,59","2,89","0,7","0,02","19,5","0,46",218,"18,1",237,309,"1,75","0,03","9,81",tr,tr,"0,48","0,21","0,74","0,07","12,4","0,11","0,55",0,"1,11","0,45",0
C0211A,"Arroz, integral, cozido, c/ óleo, cebola e alho, c/ sal,",489,116,"71,7",23,"20,9","2,46","2,03","2,14",0,"0,83",0,"0,43","0,61","0,97","0,01","2,85","0,12",188,"22,3","42,5","42,8","0,27","0,02","0,79",0,0,0,"0,34","0,07",tr,tr,"0,08",0,"0,45","4,49","0,47",0
C0303B,"Batata, doce, s/ casca, assada, c/ óleo de soja, c/ sal,",610,144,"59,2","35,1","31,2","2,18","0,28","3,88",0,"3,22",0,"0,1",tr,"0,08",0,"37,2","0,51",199,"31,9","48,1",449,"0,26","0,15","1,1",788,394,0,"1,46","0,06",tr,tr,"0,12",0,"17,4","14,6","0,47",0
C0882B,"Batata, doce, s/ casca, assada, salsa, c/ azeite de oliva, c/ pimenta-do-reino, c/ sal,",764,182,"56,7","33,3","29,6","2,09","5,28","3,73",0,"2,61",0,"0,84","3,66","0,64",0,"36,6","0,54","11,1","30,5",46,427,"0,26","0,14","1,05",746,373,0,"2,31","0,06",0,"0,01","0,11",0,"16,5","14,2","0,47",0
C0299B,"Batata, doce, s/ casca, cozida, drenada, c/ óleo de soja, c/ sal,",466,111,"73,3","22,4","19,8","0,83","2,55","2,66",0,"0,92",0,"0,4","0,55","1,5",0,21,"0,23",191,"13,6","18,8",181,"0,15","0,08","0,19",1365,682,0,"1,44","0,1",tr,"3,14","0,06",0,29,"7,21","0,47",0
C0305B,"Batata, doce, s/ casca, frita (c/ óleo de soja), c/ sal,",1061,254,"48,4","36,8","32,4","1,36","12,2","4,36",0,"1,21",0,"1,88","2,78","7,29",0,"34,4","0,38",193,"22,3","30,8",296,"0,25","0,16","0,32",2014,1007,0,"2,17","0,13",tr,"4,89","0,09",0,"42,8","8,87","0,47",0
C0118B,"Batata, inglesa, frita (c/ óleo de soja), c/ sal,Solanum tuberosum L.,",1036,248,49,"32,7","29,5","4,04","11,9","3,16",0,"2,34",0,"1,9","3,08","5,99","0,06","5,78","0,4",189,"12,8",63,442,"0,34","0,09","0,78",tr,tr,0,-,"0,16",tr,"2,26","0,09",0,"14,8","5,64","0,47",0
C0141B,"Batata, inglesa, s/ casca, assada, s/ óleo, c/ sal,Solanum tuberosum L.,",377,89,76,"20,4","18,8","2,52","0,05","1,63",0,"1,04",0,"0,01",tr,"0,02",0,"4,66","0,5",187,"18,5","54,2",549,"0,33","0,13","0,37",tr,tr,0,"0,01","0,11",tr,tr,"0,19",0,"34,9","15,7","0,47",0
C0117B,"Batata, inglesa, s/ casca, cozida, drenada, s/ óleo, c/ sal,Solanum tuberosum L.,",220,52,"85,5","12,2","10,8","1,33","0,05","1,46",0,"0,92",0,"0,01",tr,"0,02",0,"3,74","0,2",190,"5,59","25,1",231,"0,19","0,06","0,2",tr,tr,0,tr,"0,05",tr,tr,"0,09",0,"3,87","5,64","0,32",0
C0097N,"Suplemento, à  base de proteina, em pó,",1465,357,"3,44","3,22","3,22","78,1","1,56","3,1",0,"10,6",16,"0,78","0,16","0,3",0,469,"1,13",156,195,1321,500,"6,18","0,05","26,7",NA,0,0,0,"0,61","2,02","1,14","0,61","2,45",0,33,NA,NA
C0091E,"Peixe, água doce, Corimba, cozido, s/ óleo, c/ sal, Prochilodus lineatus,",628,150,"73,2",0,0,"22,2","6,8",0,0,"1,13","62,6","3,58","1,71","0,43","0,02","13,7","0,17","45,4","29,6",213,441,"0,54","0,02","29,9",tr,tr,"1,36","0,57",tr,tr,"3,96",tr,"4,37","0,84","11,8","0,45",0
C0089E,"Peixe, água doce, Corvina, cozido, s/ óleo, c/ sal, Plagioscion squamossissimus,",623,149,"70,7",0,0,"20,9","7,21",0,0,"1,24","48,5","3,01","2,77","0,36","0,05","48,3","0,61","56,6","27,4",229,381,"0,48","0,04","29,9",tr,tr,"1,36","0,57",tr,tr,"2,14",tr,"4,37","0,84","11,8","0,45",0
C0093E,"Peixe, água doce, Dourado, filé, fresco, cozido, s/ óleo, c/ sal, Brachyplatystoma flavicans,",740,177,"66,5",0,0,"18,9","11,3",0,0,"2,66",173,"4,1","3,96","1,33","0,13",711,"0,76","49,5","38,1",531,249,"2,91","0,06","29,9",tr,tr,"1,36","0,57",tr,"0,04","2,13","0,08","4,37","0,84","11,8","0,45",0
C0103E,"Peixe, água doce, filé, cozido, s/ óleo, c/ sal (média de 7 espécies),",592,141,"70,5",0,0,"23,4","5,28",0,0,"1,55","91,1","2,19","1,73","0,54","0,04",134,"0,41","51,9","30,5",249,331,"0,9","0,06","37,1","1,59","1,59","1,67","0,71","0,01","0,04","3,5","0,03","4,02","0,61","14,2","0,45",0
C0113E,"Peixe, água doce, filé, ensopado (c/ cebola, tomate e pimentão), c/ óleo, c/ sal (média de 7 espécies),",503,120,75,"1,34","0,83","17,7","4,97","0,51",0,"1,49","67,6","1,79","1,52","1,02","0,03",102,"0,45",126,"28,4",213,350,"0,72","0,07","27,6",29,"15,1","1,24","0,76","0,03","0,04","2,74","0,04","2,98","4,55","14,5","0,45",0
C0104E,"Peixe, água doce, filé, grelhado/assado, s/ óleo, c/ sal (média de 7 espécies),",590,140,"70,1",0,0,"23,2","5,26",0,0,"1,99","90,7","2,18","1,72","0,54","0,04",134,"0,41",231,"30,4",248,329,"0,89","0,06","36,9","2,19","1,89","1,66","0,71","0,01","0,04","3,49","0,03",4,"0,6","14,1","0,45",0
C0097E,"Peixe, água doce, Pintado, cozido, s/ óleo, c/ sal, Pseudoplatystoma corruscans,",456,108,"74,5",0,0,"22,3","2,08",0,0,"1,01","61,2","0,07","0,61","0,44",tr,"11,6","0,65","60,5","31,4",197,351,"0,38","0,09","48,7",0,0,"3,41","0,49","0,04","0,07","4,32","0,16","1,66",0,"23,8","0,45",0
C0099E,"Peixe, água doce, Tilápia, filé s/ pele, cozido, s/ óleo, c/ sal, Oreochromis niloticus,",471,112,"72,6",0,0,"23,1","2,12",0,0,"1,44","81,5","1,04","0,7","0,7","0,02","26,1","0,37","76,9","34,9",228,391,"0,6","0,13","29,9",tr,tr,"1,36","0,57",tr,"0,07","1,16",tr,"4,37","0,84","11,8","0,45",0
C0130E,"Peixe, água salgada, atum, assado/grelhado, s/ óleo, c/ sal, Thunnus thynnus,",631,149,"63,3",0,0,"34,5","1,17",0,0,"2,21","64,3","0,67","0,27",tr,tr,"9,92","1,46",214,39,307,351,"0,54","0,11","41,5","24,6","24,6","1,23","0,24",tr,"0,05","7,19",tr,"9,64",0,"11,8","0,45",0
C0365E,"Peixe, água salgada, bacalhau, salgado, dessalgado, cozido, s/ óleo, s/ sal,",356,84,78,0,0,"20,4","0,25",0,0,"1,33",61,"0,05","0,06","0,11",NA,17,"0,16",134,35,205,372,"0,43","0,02",NA,tr,tr,NA,NA,NA,NA,NA,NA,NA,NA,NA,NA,0
C0044E,"Peixe, água salgada, bacalhau, salgado, dessalgado, refogado,",562,133,"65,9","1,22","1,22",24,"3,61",0,0,"5,28",111,"0,9","1,1","1,2",1,"59,1","0,15",1256,"15,1","51,3","50,2","0,56","0,04",NA,tr,tr,"5,03","3,4","0,03","0,05","10,6",tr,"1,49","1,42","11,3",NA,0
C0064E,"Peixe, água salgada, Merluza, filé, frito, s/ sal,",770,184,"63,2",0,0,"26,8","8,5",0,0,"1,53",109,"1,4","2,09","4,27",NA,"35,6","0,38",90,"38,1",278,446,"0,56","0,03",NA,tr,tr,NA,NA,tr,tr,"0,77",tr,NA,NA,NA,0,0
C0228E,"Peixe, água salgada, pescada, branca, assado/grelhado, c/ manteiga e alcaparra, c/ sal,",682,163,"69,1","0,24","0,24","19,1","9,53",0,0,"1,98","69,4","3,41","3,83","1,13","0,18","20,8","0,25",391,"21,8",144,262,"0,31","0,02","38,9","2,91","3,23","5,16","1,29",0,"0,05","0,66",0,"2,51","0,2","13,8","0,45",0
C0202E,"Peixe, água salgada, salmão, filé, s/ pele, frito (c/ óleo de soja), c/ sal,Salmo salar L.,",886,213,"63,9","0,83","0,83","19,3","14,7",0,0,"1,27",53,"3,23","4,07","6,13",NA,"8,76","0,21","72,6","24,7",232,320,"0,34","0,04","21,2",0,0,"6,37","2,18","0,16","0,03","2,89",0,"2,57",0,"18,4","0,45",0
C0116B,"Couve-flor, cozida, drenada, s/ óleo, c/ sal,Brassica oleracea var. botrytis L.,",69,16,"94,8","3,41","1,36","1,28","0,2","2,05",0,"0,32",0,"0,08",tr,"0,08",0,"14,9","0,12",129,"5,01","23,4","74,1","0,24",tr,"0,34","3,67","1,83",0,"0,03","0,03",tr,tr,tr,0,"21,8","32,7","0,32",0
C0091T,"Feijão, carioca, cozido (50% grão e 50% caldo), c/ óleo, cebola e alho, c/ sal,Phaseolus vulgaris L.,",330,79,"77,7","14,6","7,77","4,69","1,72","6,84",0,"1,3",0,"0,28","0,38","1,01","0,01","28,2","1,34",190,"44,2","92,7",276,"0,74","0,2","0,05","0,26","0,13",0,"0,9","0,04",tr,tr,"0,01",0,"0,45","94,3","0,47",0
C0151B,"Abóbora, moranga, refogada (c/ óleo, cebola e alho), c/ sal,",124,30,"92,5","5,98","4,44","0,39","0,8","1,55",0,"0,37",0,"0,12","0,19","0,45",0,"19,2","0,11",130,"7,5","11,7",183,"0,08","0,04","1,07","95,3","47,7",0,"1,51","0,05",tr,tr,"0,05",-,"6,73","8,45","0,32",0
C0355B,"Abóbora, moranga, s/ casca, s/ semente, assada, s/ óleo, c/ sal,",107,26,91,"5,92","2,33","1,8","0,21","3,59",0,"1,06",0,"0,05","0,03","0,02",0,5,tr,127,"2,99","12,8",201,"0,11","0,08","1,78",513,256,0,"2,23",tr,tr,tr,"0,09",0,"12,5","11,6","0,32",0
C0226B,"Abóbora, moranga, s/ casca, s/ semente, cozida, drenada, c/ óleo de soja, c/ sal,",158,38,"91,6","3,89","1,53","1,18","2,52","2,36",0,"0,81",0,"0,39","0,58","1,44","0,01","3,15",tr,127,"1,18","7,55","66,2","0,06","0,06","1,05",334,167,0,"1,75",0,tr,tr,"0,04",0,"6,65","5,45","0,32",0
C0228B,"Abóbora, pescoço, s/ casca, s/ semente, cozida, drenada, s/ óleo, c/ sal,",108,26,"91,5","6,65","4,15","0,73","0,13","2,5",0,"0,97",0,"0,03","0,02","0,01",0,"9,17","0,23",128,"4,84","30,9",143,"0,14","0,09","1,08",525,262,0,"1,38",tr,tr,tr,"0,04",0,"1,48","7,76",0,0
C0232B,"Abobrinha, italiana, c/ casca, cozida, drenada, c/ óleo de soja, c/ sal,",146,35,"92,9","2,75","1,28","0,96","2,61","1,47",0,"0,74",0,"0,47","0,56","1,54",0,"15,5","0,15",128,"15,6","20,7",116,"0,24","0,02","0,07","74,2","37,1",0,"0,36","0,05",tr,tr,"0,06",0,"1,97","25,5","0,32",0
C0153B,"Abobrinha, italiana, c/ casca, refogada (c/ óleo, cebola e alho), c/ sal,",107,26,"93,5","4,19","2,81","1,07","0,82","1,38",0,"0,43",0,"0,13","0,18","0,46",0,"20,7","0,36",130,"12,7","31,8",193,"0,27","0,02",-,"41,6","20,8",-,-,"0,04",tr,tr,tr,0,"7,53",-,"0,32",0
C0063B,"Alface, americana, crua,Lactuca sativa L.,",25,6,"97,7","1,5","0,26","0,41","0,11","1,24",0,"0,28",0,"0,15",tr,"0,06",0,"11,7","0,22","5,93","4,65","15,7",110,"0,18","0,02","0,2",317,158,0,"0,13","0,02",tr,tr,"0,03",0,"8,89","13,3",0,0
C0060B,"Alface, crespa, crua,Lactuca sativa L.,",43,10,"96,1","1,7",0,"1,35","0,16","1,83",0,"0,7",0,"0,21",tr,"0,09",0,38,"0,4","3,38",11,"25,8",267,"0,25","0,03","0,2",329,164,0,"0,23","0,11","0,12","1,09",tr,0,"15,6","29,6",0,0
C0009B,"Alface, crua,Lactuca sativa L.,",37,9,"96,4","1,79",0,"1,08","0,12","1,87",0,"0,56",0,"0,2",tr,"0,08",0,"37,5","0,75","4,2","12,7",26,311,"0,29","0,03","0,2",364,182,0,"0,18","0,1","0,1","0,92","0,04",0,"18,5","26,9",0,0
C0022A,"Aveia, farinha, crua, Avena sativa,Mac Bits,",1559,370,"9,8",67,"56,7","14,9",7,"10,3",0,"1,3",0,"1,27","2,6","2,49",NA,"47,5","4,41","4,59",117,152,333,"2,61","0,44",NA,0,0,0,NA,"0,55","0,03","4,44",tr,0,"1,34",55,0,0
C0024A,"Aveia, flocos, finos, Avena sativa,Float,",1594,379,"9,8","64,5",55,"15,6","8,6","9,5",0,"1,5",0,"1,56","3,19","3,05",NA,"47,5","4,41","4,59",117,152,333,"2,61","0,44",NA,0,0,0,NA,"0,55","0,03","4,44",tr,0,"1,34",55,0,0
C0044B,"Beterraba, s/ casca, cozida, drenada, s/ óleo, s/ sal,Beta vulgaris L.,",113,27,"91,8","6,29","4,25","1,23","0,09","2,04",-,"0,62",0,"0,01","0,02","0,03",0,"13,3","0,21","19,9","14,4","26,3",214,"0,31","0,03","0,18","1,78","0,89",0,"0,02","0,08",tr,tr,tr,0,"1,08","50,9",0,0
C0913B,"Cenoura, s/ casca, cozida, drenada, s/ óleo, c/ sal,Daucus carota L.,",70,17,"94,3","4,3","2,12","0,54","0,19","2,17",0,"0,7",0,0,0,"0,09",0,"16,7","0,17",132,"9,39","17,3",231,"0,15","0,01","0,3",658,329,0,"1,11","0,05",0,"1,74","0,04",0,0,"7,7","0,32",0
C0020B,"Cenoura, s/ casca, crua,Daucus carota L.,",128,31,"90,2","7,55","4,56","1,12","0,21","2,98",0,"0,91",0,"0,03","0,01","0,1",0,"21,4","0,47","11,1","11,4","26,9",278,"0,3","0,07","0,6",740,370,0,"0,58",tr,tr,tr,"0,05",0,"5,12","15,9",0,0
C0144B,"Couve, cozida, drenada, s/ óleo, c/ sal,Brassica oleracea var. Acephala,",106,25,"91,6","4,01","1,12","2,66","0,51","2,89",0,"1,25",0,"0,11",tr,"0,12",0,236,"0,57",138,"41,4","40,6",582,"0,21","0,04","0,24",466,233,0,"1,08",0,0,0,0,0,0,"12,5","0,32",0
C0020G,"Iogurte, natural (média de diferentes amostras),",239,57,"87,8","4,76","4,76","4,02","2,43",0,0,"0,98",11,"1,44","0,72","0,08",NA,133,"0,18","47,7",11,"85,6",124,"0,32","0,02","1,7","36,2","35,9","0,07","0,04","0,04","0,27",tr,tr,"0,37","1,13","7,05",0,0
C0022G,"Iogurte, natural, desnatado,",204,48,"87,5","7,04","7,04","4,04","0,42",0,0,"0,96","4,41","0,26","0,13",NA,"0,01",181,tr,"68,9","13,8",126,210,"0,59",tr,"1,7","4,64","4,64",0,0,tr,"0,25",tr,tr,"0,51","0,4","10,1",0,0
C0962A,"Macarrão, trigo integral, c/ atum em conserva, salsa, c/ azeite de oliva, c/ sal,",689,164,"64,3","18,9","16,4","9,78","6,06","2,47",0,"1,03","14,6","0,99","3,43","1,42","0,01","8,82","0,66",278,"15,9","86,4",105,"0,45","0,06",15,"2,96","1,48","1,35","1,27","0,1","0,05","2,17","0,06","0,48","0,18","13,5","0,47",0
